{
  "schema_version": "1.0.0",
  "summary_id": "tms:inc-osbench-phase3-tactical-v1-foothill_access-seed-4101:seed-4101",
  "tactical_bundle_id": "tsb:inc-osbench-phase3-tactical-v1-foothill_access-seed-4101:foothill_access:seed-4101",
  "episode_id": "ep:tactical:inc-osbench-phase3-tactical-v1-foothill_access-seed-4101:seed-4101",
  "incident_packet_id": "pkt:inc-osbench-phase3-tactical-v1-foothill_access-seed-4101:0001",
  "summary_fingerprint": "9b2cf5acb3880c9df5dcce6415f9a8706f9ce0c170b57d6f55a2a0d885890c2d",
  "dispatched_unit_count": 4,
  "arrived_unit_count": 3,
  "route_completion_ratio": 0.75,
  "containment_progress": 0.68,
  "mean_dispatch_latency_seconds": 248,
  "facility_utilization_peak": 0.83,
  "operational_score": 0.74,
  "metric_components": {
    "dispatch_latency_score": 0.79,
    "coverage_score": 0.72,
    "facility_load_penalty": -0.09
  }
}
